{
  "schemaVersion": "1.0.0",
  "generatedAt": "2026-03-17T17:30:00.000Z",
  "masterFile": {
    "fileKey": "1IqfGdn5XxqnBm3CZ5rFH1",
    "url": "https://www.figma.com/design/1IqfGdn5XxqnBm3CZ5rFH1/Partner_Master-Design-System_V2_10162025?m=dev"
  },
  "components": [
    {
      "componentName": "PButton",
      "repoStatus": "implemented",
      "status": "matched",
      "notes": "Grounded from the canonical button matrix and link-specific documentation page. This is the current source of truth for button size, style, type, state, and icon-only naming.",
      "figmaNodes": [
        {
          "nodeId": "1:118",
          "nodeName": "    Button🟢",
          "nodeType": "CANVAS",
          "role": "page",
          "url": "https://www.figma.com/design/1IqfGdn5XxqnBm3CZ5rFH1/Partner_Master-Design-System_V2_10162025?node-id=1-118&m=dev",
          "notes": "Top-level button page that contains the main matrix and link treatment."
        },
        {
          "nodeId": "11:622",
          "nodeName": "Buttons/Main",
          "nodeType": "FRAME",
          "role": "canonical",
          "url": "https://www.figma.com/design/1IqfGdn5XxqnBm3CZ5rFH1/Partner_Master-Design-System_V2_10162025?node-id=11-622&m=dev",
          "notes": "Canonical variant matrix for contained, outlined, and text buttons, including icon-only variants."
        },
        {
          "nodeId": "11:1147",
          "nodeName": "Button/Link",
          "nodeType": "FRAME",
          "role": "reference",
          "url": "https://www.figma.com/design/1IqfGdn5XxqnBm3CZ5rFH1/Partner_Master-Design-System_V2_10162025?node-id=11-1147&m=dev",
          "notes": "Link-style treatment used when `PButton` is rendered with link-like emphasis."
        },
        {
          "nodeId": "578:8757",
          "nodeName": "Button/Main Documentation",
          "nodeType": "FRAME",
          "role": "documentation",
          "url": "https://www.figma.com/design/1IqfGdn5XxqnBm3CZ5rFH1/Partner_Master-Design-System_V2_10162025?node-id=578-8757&m=dev",
          "notes": "Usage guidance and anatomy for main buttons."
        },
        {
          "nodeId": "578:9001",
          "nodeName": "Button/Link Documentation",
          "nodeType": "FRAME",
          "role": "documentation",
          "url": "https://www.figma.com/design/1IqfGdn5XxqnBm3CZ5rFH1/Partner_Master-Design-System_V2_10162025?node-id=578-9001&m=dev",
          "notes": "Usage guidance for link-style button behavior."
        }
      ]
    },
    {
      "componentName": "PIcon",
      "repoStatus": "implemented",
      "status": "matched",
      "notes": "Grounded from the icons page and its documentation. This page is the current source for available icon names and usage constraints.",
      "figmaNodes": [
        {
          "nodeId": "1:120",
          "nodeName": "    Icon🟢",
          "nodeType": "CANVAS",
          "role": "page",
          "url": "https://www.figma.com/design/1IqfGdn5XxqnBm3CZ5rFH1/Partner_Master-Design-System_V2_10162025?node-id=1-120&m=dev",
          "notes": "Top-level icon page."
        },
        {
          "nodeId": "9:5113",
          "nodeName": "Icons",
          "nodeType": "FRAME",
          "role": "canonical",
          "url": "https://www.figma.com/design/1IqfGdn5XxqnBm3CZ5rFH1/Partner_Master-Design-System_V2_10162025?node-id=9-5113&m=dev",
          "notes": "Canonical icon catalog, including names such as `Search`, `Menu`, `Chevron--down`, and Partner-specific icons."
        },
        {
          "nodeId": "578:9615",
          "nodeName": "Icons Documentation",
          "nodeType": "FRAME",
          "role": "documentation",
          "url": "https://www.figma.com/design/1IqfGdn5XxqnBm3CZ5rFH1/Partner_Master-Design-System_V2_10162025?node-id=578-9615&m=dev",
          "notes": "Usage guidance states icons are not standalone interactive elements and should remain within fixed sizing constraints."
        }
      ]
    },
    {
      "componentName": "PLogo",
      "repoStatus": "implemented",
      "status": "matched",
      "notes": "Grounded from the logo page and logo matrix for brand variants, favicon variants, and brand-specific lockups.",
      "figmaNodes": [
        {
          "nodeId": "127:21",
          "nodeName": "    Logo🟢",
          "nodeType": "CANVAS",
          "role": "page",
          "url": "https://www.figma.com/design/1IqfGdn5XxqnBm3CZ5rFH1/Partner_Master-Design-System_V2_10162025?node-id=127-21&m=dev",
          "notes": "Top-level logo page."
        },
        {
          "nodeId": "127:315",
          "nodeName": "Partner Logo",
          "nodeType": "FRAME",
          "role": "canonical",
          "url": "https://www.figma.com/design/1IqfGdn5XxqnBm3CZ5rFH1/Partner_Master-Design-System_V2_10162025?node-id=127-315&m=dev",
          "notes": "Canonical logo matrix covering Partner, SiteLynx, BlueLynx, Plink-Live, and favicon variants."
        }
      ]
    },
    {
      "componentName": "PTypography",
      "repoStatus": "implemented",
      "status": "matched",
      "notes": "Grounded from the typography table. This is the current source of truth for typography variant names that map to `PTypography`.",
      "figmaNodes": [
        {
          "nodeId": "10:8314",
          "nodeName": "Typography",
          "nodeType": "FRAME",
          "role": "canonical",
          "url": "https://www.figma.com/design/1IqfGdn5XxqnBm3CZ5rFH1/Partner_Master-Design-System_V2_10162025?node-id=10-8314&m=dev",
          "notes": "Canonical typography table confirming names such as `h1`, `headline 1`, `body 1`, `inputLabel`, and `tooltip`."
        }
      ]
    },
    {
      "componentName": "PLayoutGrid",
      "repoStatus": "implemented",
      "status": "matched",
      "notes": "Grounded from the layout grid page. This is the current source of truth for breakpoint, gutter, margin, and alignment rules that back the layout grid primitives in the repo.",
      "figmaNodes": [
        {
          "nodeId": "1:122",
          "nodeName": "    Layout Grid🟢",
          "nodeType": "CANVAS",
          "role": "page",
          "url": "https://www.figma.com/design/1IqfGdn5XxqnBm3CZ5rFH1/Partner_Master-Design-System_V2_10162025?node-id=1-122&m=dev",
          "notes": "Top-level layout grid page."
        },
        {
          "nodeId": "125:21",
          "nodeName": "Layout Grid",
          "nodeType": "FRAME",
          "role": "canonical",
          "url": "https://www.figma.com/design/1IqfGdn5XxqnBm3CZ5rFH1/Partner_Master-Design-System_V2_10162025?node-id=125-21&m=dev",
          "notes": "Canonical breakpoint table for `xl`, `lg`, `md`, and `sm`, plus example body container layouts."
        },
        {
          "nodeId": "578:9715",
          "nodeName": "Body Container Layout Grid Documentation",
          "nodeType": "FRAME",
          "role": "documentation",
          "url": "https://www.figma.com/design/1IqfGdn5XxqnBm3CZ5rFH1/Partner_Master-Design-System_V2_10162025?node-id=578-9715&m=dev",
          "notes": "Documentation describing how body content aligns below the main navigation bar and responds across breakpoints."
        }
      ]
    },
    {
      "componentName": "PLayoutGridItem",
      "repoStatus": "implemented",
      "status": "matched",
      "notes": "Mapped to the same grid system source as `PLayoutGrid`. The Figma page defines the column structure and container behavior that individual grid items should honor.",
      "figmaNodes": [
        {
          "nodeId": "125:21",
          "nodeName": "Layout Grid",
          "nodeType": "FRAME",
          "role": "canonical",
          "url": "https://www.figma.com/design/1IqfGdn5XxqnBm3CZ5rFH1/Partner_Master-Design-System_V2_10162025?node-id=125-21&m=dev",
          "notes": "Canonical column and breakpoint system used by grid items."
        }
      ]
    },
    {
      "componentName": "PMainNavBar",
      "repoStatus": "planned",
      "status": "unmapped",
      "notes": "The Figma main navigation bar exists, but there is no public Partner component in this repo yet. Keep this mapping so the implementation can be attached once the component is built.",
      "figmaNodes": [
        {
          "nodeId": "128:24",
          "nodeName": "    Main Nav Bar 🟡",
          "nodeType": "CANVAS",
          "role": "page",
          "url": "https://www.figma.com/design/1IqfGdn5XxqnBm3CZ5rFH1/Partner_Master-Design-System_V2_10162025?node-id=128-24&m=dev",
          "notes": "Top-level main navigation page."
        },
        {
          "nodeId": "561:8400",
          "nodeName": "Main Navigation Bar",
          "nodeType": "FRAME",
          "role": "canonical",
          "url": "https://www.figma.com/design/1IqfGdn5XxqnBm3CZ5rFH1/Partner_Master-Design-System_V2_10162025?node-id=561-8400&m=dev",
          "notes": "Canonical main navigation bar with left and center alignment variants."
        },
        {
          "nodeId": "282:69171",
          "nodeName": "Main Navigation Bar Item",
          "nodeType": "FRAME",
          "role": "reference",
          "url": "https://www.figma.com/design/1IqfGdn5XxqnBm3CZ5rFH1/Partner_Master-Design-System_V2_10162025?node-id=282-69171&m=dev",
          "notes": "Reference frame for nav items, nav groups, icon groups, and page labels."
        },
        {
          "nodeId": "578:7636",
          "nodeName": "Main Navigation Bar Documentation",
          "nodeType": "FRAME",
          "role": "documentation",
          "url": "https://www.figma.com/design/1IqfGdn5XxqnBm3CZ5rFH1/Partner_Master-Design-System_V2_10162025?node-id=578-7636&m=dev",
          "notes": "Documentation describing anatomy, variants, responsiveness, and token usage. Attach this to the component once implementation begins."
        }
      ]
    },
    {
      "componentName": "PSideNavPanel",
      "repoStatus": "planned",
      "status": "unmapped",